{
  "artifact_type": "ranking",
  "as_of_date": "2025-09-18",
  "config_fingerprint": "7da318e9bf2a3f80782b3370fe5246eff1be663b92e098a6cfdb97b904eb55c7",
  "environment": "local",
  "generated_at": "2026-04-20T22:01:21.164828Z",
  "hidden_composite_alpha_score": false,
  "method": "transparent_weighted_sum",
  "ranked_packets": [],
  "run_id": "run_local_20250918_3e3337a6d2837850",
  "schema_version": "v1.0.0"
}